{
  "$schema": "http://json-schema.org/draft-07/schema#",
  "title": "VIT Config",
  "description": "Configuration for VIT (Version It!) — version and release manager.",
  "type": "object",
  "additionalProperties": false,
  "properties": {
    "$schema": {
      "type": "string",
      "description": "File schema configuration URL."
    },
    "changelog": {
      "type": "object",
      "description": "Changelog file configuration.",
      "additionalProperties": false,
      "properties": {
        "path": {
          "type": "string",
          "description": "Path to the changelog file (e.g. './CHANGELOG.md').",
          "default": "./CHANGELOG.md"
        },
        "title": {
          "type": "string",
          "description": "Title of the changelog.",
          "default": "Changelog"
        },
        "semantic": {
          "type": "boolean",
          "description": "If true, the changelog is generated from git tags (semantic mode). If false, it is managed manually.",
          "default": false
        }
      }
    },
    "git": {
      "type": "object",
      "description": "Git configuration for commits, releases and branches.",
      "additionalProperties": false,
      "properties": {
        "defaultCommitMessage": {
          "type": "string",
          "description": "Default commit message for regular commit operations.",
          "default": "chore: update"
        },
        "releaseCommitMessage": {
          "type": "string",
          "description": "Default commit message when performing a release.",
          "default": "chore: release"
        },
        "changelogCommitMessage": {
          "type": "string",
          "description": "Default commit message when updating the changelog.",
          "default": "docs: update changelog"
        },
        "strict": {
          "type": "boolean",
          "description": "If true, releases are blocked from branches not listed in 'releaseBranches'. If false, only a warning is shown.",
          "default": true
        },
        "releaseBranches": {
          "type": "array",
          "description": "List of branches from which releases are allowed. Supports glob patterns (e.g. 'release/*').",
          "items": {
            "type": "string",
            "description": "Allowed branch name or glob pattern (e.g. 'main', 'release/*')."
          },
          "default": ["main"],
          "minItems": 1
        },
        "preReleaseBranches": {
          "type": "array",
          "description": "List of branches from which pre-releases are allowed. When VIT detects the current branch here, it automatically uses a prerelease bump (e.g. 1.2.0-beta.1). Fully opt-in — if omitted, no pre-release behavior is applied.",
          "items": {
            "type": "object",
            "description": "A pre-release branch configuration.",
            "additionalProperties": false,
            "required": ["name"],
            "properties": {
              "name": {
                "type": "string",
                "description": "Branch name (exact match, e.g. 'beta', 'alpha', 'next'). Does not support glob patterns."
              },
              "id": {
                "type": "string",
                "description": "Pre-release identifier used in the version tag (e.g. 'beta' → '1.2.0-beta.1'). Defaults to the branch name if omitted."
              }
            }
          },
          "default": []
        },
        "rollbackStrategy": {
          "type": "string",
          "description": "'revert' creates a new commit that undoes changes (history preserved, recommended). 'reset' rewrites history (requires force push, use only on personal repos).",
          "enum": ["revert", "reset"],
          "default": "revert"
        },
        "promoteStrategy": {
          "type": "string",
          "description": "Strategy used when promoting a prerelease branch to stable. 'merge' performs a local merge into the target branch and syncs both branches. 'pr' bumps the stable version on the prerelease branch, pushes it, and opens a GitHub Pull Request — requires config.github.token (or GITHUB_TOKEN env) and config.github.repo.",
          "enum": ["merge", "pr"],
          "default": "merge"
        }
      }
    },
    "github": {
      "type": "object",
      "description": "GitHub API settings. Required when git.promoteStrategy is 'pr'.",
      "additionalProperties": false,
      "properties": {
        "token": {
          "type": "string",
          "description": "GitHub personal access token or GITHUB_TOKEN. The GITHUB_TOKEN environment variable takes precedence over this value."
        },
        "repo": {
          "type": "string",
          "description": "Repository slug in 'owner/repo' format (e.g. 'my-org/my-repo'). Auto-detected from git remote origin when omitted.",
          "pattern": "^[^/]+/[^/]+$"
        }
      }
    },
    "vcs": {
      "type": "object",
      "description": "Version control system configuration.",
      "additionalProperties": false,
      "properties": {
        "provider": {
          "type": "string",
          "description": "VCS provider to use.",
          "enum": ["git"],
          "default": "git"
        }
      }
    },
    "envFile": {
      "type": "string",
      "description": "Path to a global .env file loaded for all actions. Variables here have lower priority than action-level envFile, env and promptEnv.",
      "default": ".env"
    },
    "projects": {
      "type": "array",
      "description": "List of projects managed by VIT. Each project has its own package.json and can be versioned independently.",
      "minItems": 1,
      "items": {
        "type": "object",
        "description": "Configuration for an individual project.",
        "additionalProperties": false,
        "required": ["id", "label", "path", "tagPrefix"],
        "properties": {
          "id": {
            "type": "string",
            "description": "Unique project identifier. Used in CLI with --projects and in built-in variables as ${version.<id>} and ${name.<id>}."
          },
          "label": {
            "type": "string",
            "description": "Human-readable project name shown in the interface."
          },
          "path": {
            "type": "string",
            "description": "Relative path to the project directory (where its package.json is located).",
            "default": "."
          },
          "tagPrefix": {
            "type": "string",
            "description": "Prefix used for git tags (e.g. 'v' generates tags like 'v1.2.3').",
            "default": "v"
          }
        }
      }
    },
    "types": {
      "type": "array",
      "description": "Customize or extend the commit types available in the changelog. Merged with the default types (feat, fix, refactor, perf, revert, docs, style).",
      "items": {
        "type": "object",
        "description": "A commit type entry.",
        "additionalProperties": false,
        "required": ["value"],
        "properties": {
          "value": {
            "type": "string",
            "description": "Commit type identifier (e.g. 'feat', 'fix', 'deploy')."
          },
          "label": {
            "type": "string",
            "description": "Label shown as the changelog section header (e.g. '🚀 Features')."
          },
          "choiceLabel": {
            "type": "string",
            "description": "Label shown in the interactive prompt choice list (e.g. '🚀 feat — New feature')."
          }
        }
      }
    },
    "preActions": {
      "type": "array",
      "description": "Actions executed BEFORE the main operation (commit, release or changelog).",
      "items": {
        "$ref": "#/definitions/action"
      }
    },
    "postActions": {
      "type": "array",
      "description": "Actions executed AFTER the main operation (commit, release or changelog).",
      "items": {
        "$ref": "#/definitions/action"
      }
    }
  },
  "definitions": {
    "onEvents": {
      "type": "array",
      "description": "Events on which this action is triggered.",
      "minItems": 1,
      "items": {
        "type": "string",
        "enum": ["commit", "release", "changelog"],
        "description": "'commit' = regular commits. 'release' = version bumps. 'changelog' = changelog-only commits."
      }
    },
    "promptEnvEntry": {
      "type": "object",
      "description": "An environment variable that is asked interactively to the user before the action runs. Has the highest priority over all other env sources.",
      "additionalProperties": false,
      "required": ["name"],
      "properties": {
        "name": {
          "type": "string",
          "description": "Name of the environment variable (e.g. 'SSH_PASS' → available as ${SSH_PASS})."
        },
        "message": {
          "type": "string",
          "description": "Prompt message shown to the user (e.g. 'SSH password:')."
        },
        "validate": {
          "type": "string",
          "description": "Built-in validation rule. Currently supported: 'otp' (validates a 6-digit code).",
          "enum": ["otp"]
        }
      }
    },
    "pipelineStep": {
      "type": "object",
      "description": "A pipeline step that runs a command and optionally captures its stdout as an environment variable.",
      "additionalProperties": false,
      "required": ["command"],
      "properties": {
        "id": {
          "type": "string",
          "description": "Unique step identifier."
        },
        "label": {
          "type": "string",
          "description": "Human-readable step description shown in the spinner."
        },
        "command": {
          "type": "string",
          "description": "Shell command to execute. Its stdout is captured if 'captureAs' is set."
        },
        "captureAs": {
          "type": "string",
          "description": "Name of the environment variable where stdout is stored (e.g. 'VERSION' → available as ${VERSION} in subsequent steps and the main command)."
        },
        "cwd": {
          "type": "string",
          "description": "Working directory for this step. Defaults to the parent action's cwd."
        },
        "continueOnError": {
          "type": "boolean",
          "description": "If true, the pipeline continues even if this step fails.",
          "default": false
        },
        "showOutput": {
          "type": "boolean",
          "description": "If true, the step's stdout is printed to the terminal. Default is false for pipeline steps.",
          "default": false
        },
        "timeoutMs": {
          "type": "number",
          "description": "Maximum execution time in milliseconds. null means no limit.",
          "minimum": 1
        }
      }
    },
    "action": {
      "type": "object",
      "description": "An action executed before or after the main VIT operation.",
      "additionalProperties": false,
      "required": ["id", "label", "on", "command"],
      "properties": {
        "id": {
          "type": "string",
          "description": "Unique action identifier."
        },
        "label": {
          "type": "string",
          "description": "Human-readable action name shown in the spinner."
        },
        "on": {
          "$ref": "#/definitions/onEvents"
        },
        "command": {
          "type": "string",
          "description": "Shell command to execute. Can interpolate built-in variables (${version}, ${date}, ${branch}...) and variables captured from the pipeline (${VAR_NAME})."
        },
        "cwd": {
          "type": "string",
          "description": "Working directory for this action. Defaults to the project root. Also determines the value of built-in variables like ${version} and ${name}.",
          "default": "."
        },
        "continueOnError": {
          "type": "boolean",
          "description": "If true, VIT continues even if this action fails.",
          "default": false
        },
        "showOutput": {
          "type": "boolean",
          "description": "If true, the command output is printed to the terminal.",
          "default": true
        },
        "timeoutMs": {
          "type": "number",
          "description": "Maximum execution time in milliseconds. null means no limit.",
          "minimum": 1
        },
        "envFile": {
          "type": "string",
          "description": "Path to a .env file specific to this action. Overrides variables from the global envFile with the same name."
        },
        "env": {
          "type": "object",
          "description": "Static environment variables available to this action. Higher priority than envFile.",
          "additionalProperties": {
            "type": "string"
          }
        },
        "promptEnv": {
          "type": "array",
          "description": "Variables asked interactively to the user before running the action. Highest priority over all other env sources. Stops headless execution until input is received.",
          "items": {
            "$ref": "#/definitions/promptEnvEntry"
          }
        },
        "pipeline": {
          "type": "array",
          "description": "Steps executed before the main command. Each step can capture its stdout into an environment variable available to subsequent steps and the final command via ${VAR_NAME}.",
          "items": {
            "$ref": "#/definitions/pipelineStep"
          }
        }
      }
    }
  }
}
