{
  "changelog": {
    "path": "./CHANGELOG.md",
    "title": "Changelog",
    "semantic": false
  },
  "git": {
    "defaultCommitMessage": "chore: update",
    "releaseCommitMessage": "chore: release",
    "changelogCommitMessage": "docs: update changelog",
    "strict": true,
    "releaseBranches": ["main"]
  },
  "vcs": {
    "provider": "git"
  },
  "envFile": ".env",
  "projects": [
    {
      "id": "vit",
      "label": "VIT",
      "path": ".",
      "tagPrefix": "v"
    }
  ],
  "preActions": [
    {
      "id": "testing",
      "label": "Tests execution",
      "on": ["commit", "release"],
      "continueOnError": false,
      "showOutput": true,
      "command": "npm run test"
    }
  ],
  "postActions": [
    {
      "id": "release-summary",
      "label": "Release summary",
      "on": ["release"],
      "continueOnError": false,
      "showOutput": true,
      "command": "node -e \"console.log('\\n  🎉 Released!\\n  Version  : ${version.vit}\\n  Tag      : ${last_tag}\\n  Name     : ${name}\\n  Date     : ${date}\\n')\""
    }
  ]
}